{
  "$schema": "../../runtime/schemas/product-asset-portfolio.schema.json",
  "portfolioId": "hermes-product-slate-2026-08-17",
  "source": "C:/Users/frank/starlight/repos/frankx-strategy/09-evidence/product-funnel-os-2026-08-17/catalog/overlay.json",
  "scope": "Complete classification of the 47-item slate supplied to the audited Hermes Product Funnel OS; not an exhaustive claim over every estate idea.",
  "summary": {
    "productCount": 47,
    "byBrand": {
      "frankx": 27,
      "gencreator": 8,
      "sis": 6,
      "arcanea": 6
    },
    "byReleaseState": {
      "public": 14,
      "validation": 23,
      "internal-only": 10
    }
  },
  "brands": {
    "frankx": {
      "name": "FrankX",
      "brandPack": "brand-image-system/runtime/brands/frankx/brand-pack.json",
      "canonicalLogos": [
        "frankx.ai-vercel-website/public/images/brand/logo-full-v2.png",
        "frankx.ai-vercel-website/public/images/brand/logo-mark-v2.png"
      ],
      "fonts": [
        "Outfit",
        "Inter",
        "IBM Plex Mono"
      ],
      "colors": [
        "#050914",
        "#00D4FF",
        "#F6FAFF",
        "#F2B84B"
      ],
      "identityRule": "Use the actual cyan FrankX assets; never type a substitute wordmark."
    },
    "gencreator": {
      "name": "GenCreator",
      "brandPack": "brand-image-system/runtime/brands/gencreator/brand-pack.json",
      "canonicalLogos": [
        "gencreator.ai/public/brand/gencreator-wordmark.svg",
        "gencreator.ai/public/brand/gencreator-mark.svg"
      ],
      "fonts": [
        "Inter",
        "Sora"
      ],
      "colors": [
        "#05060A",
        "#F1F7FF",
        "#6EA8FE",
        "#38BDF8",
        "#34D399"
      ],
      "identityRule": "Use the canonical wordmark and mark; center the owned-work mechanism."
    },
    "sis": {
      "name": "Starlight Intelligence",
      "brandPack": "brand-image-system/runtime/brands/sis/brand-pack.json",
      "canonicalLogos": [],
      "fonts": [
        "IBM Plex Sans",
        "IBM Plex Mono"
      ],
      "colors": [
        "#07090B",
        "#E7E0D2",
        "#B89A5A",
        "#8EA6A0"
      ],
      "identityRule": "No canonical logo was verified in this experiment. Use a typographic signature; do not invent a mark."
    },
    "arcanea": {
      "name": "Arcanea",
      "brandPack": "brand-image-system/runtime/brands/arcanea/brand-pack.json",
      "canonicalLogos": [
        "arcanea-ai-app/apps/web/public/brand/arcanea-wordmark.svg",
        "arcanea-ai-app/apps/web/public/brand/arcanea-logo.svg"
      ],
      "fonts": [
        "Plus Jakarta Sans",
        "Georgia"
      ],
      "colors": [
        "#05040A",
        "#7FFFD4",
        "#A78BFA",
        "#9B59FF",
        "#C7A86B"
      ],
      "identityRule": "Use canonical product chrome; generated world media remains a source layer."
    }
  },
  "products": [
    {
      "id": "fx-atlas",
      "brandId": "frankx",
      "name": "AI Architecture Atlas",
      "sourceKind": "platform",
      "productForm": "platform",
      "status": "live",
      "commercialState": "free-public",
      "releaseState": "public",
      "coverPolicy": "Proof-first public cover; use verified product state and approved public copy.",
      "targetUrl": "https://frankx.ai/ai-architecture",
      "assetFamilies": [
        "product-card",
        "verified-ui-proof",
        "mechanism-diagram",
        "open-graph"
      ]
    },
    {
      "id": "fx-decision-kit",
      "brandId": "frankx",
      "name": "Architecture Decision Kit",
      "sourceKind": "kit",
      "productForm": "kit",
      "status": "building",
      "commercialState": null,
      "releaseState": "validation",
      "coverPolicy": "Concept/validation cover allowed with exact status; no price, availability, customer, or launch claim.",
      "targetUrl": "https://frankx.ai/decision-kit",
      "assetFamilies": [
        "kit-cover",
        "contents-card",
        "mechanism-infographic",
        "delivery-preview"
      ]
    },
    {
      "id": "fx-coe-workspace",
      "brandId": "frankx",
      "name": "AI CoE Blueprint Workspace",
      "sourceKind": "saas",
      "productForm": "saas",
      "status": "queued",
      "commercialState": null,
      "releaseState": "validation",
      "coverPolicy": "Concept/validation cover allowed with exact status; no price, availability, customer, or launch claim.",
      "targetUrl": "https://frankx.ai/coe",
      "assetFamilies": [
        "product-card",
        "desktop-proof",
        "mobile-proof",
        "open-graph"
      ]
    },
    {
      "id": "fx-sprint",
      "brandId": "frankx",
      "name": "Venture Signal Sprint",
      "sourceKind": "sprint",
      "productForm": "sprint",
      "status": "building",
      "commercialState": null,
      "releaseState": "validation",
      "coverPolicy": "Concept/validation cover allowed with exact status; no price, availability, customer, or launch claim.",
      "targetUrl": "https://frankx.ai/sprint",
      "assetFamilies": [
        "offer-cover",
        "process-strip",
        "deliverable-stack",
        "scope-page-open-graph"
      ]
    },
    {
      "id": "fx-foundry",
      "brandId": "frankx",
      "name": "Foundry / Personal AI CoE Install",
      "sourceKind": "implementation",
      "productForm": "implementation",
      "status": "queued",
      "commercialState": null,
      "releaseState": "validation",
      "coverPolicy": "Concept/validation cover allowed with exact status; no price, availability, customer, or launch claim.",
      "targetUrl": "https://frankx.ai/foundry",
      "assetFamilies": [
        "offer-cover",
        "scope-map",
        "deliverable-stack",
        "application-card"
      ]
    },
    {
      "id": "fx-academy",
      "brandId": "frankx",
      "name": "AI Architect Academy",
      "sourceKind": "course",
      "productForm": "course",
      "status": "live",
      "commercialState": null,
      "releaseState": "public",
      "coverPolicy": "Proof-first public cover; use verified product state and approved public copy.",
      "targetUrl": "https://frankx.ai/academy",
      "assetFamilies": [
        "course-card",
        "curriculum-map",
        "lesson-proof",
        "open-graph"
      ]
    },
    {
      "id": "fx-coe-lab",
      "brandId": "frankx",
      "name": "AI CoE Architect Lab",
      "sourceKind": "course",
      "productForm": "course",
      "status": "queued",
      "commercialState": null,
      "releaseState": "validation",
      "coverPolicy": "Concept/validation cover allowed with exact status; no price, availability, customer, or launch claim.",
      "targetUrl": "https://aiarchitectacademy.com/",
      "assetFamilies": [
        "course-card",
        "curriculum-map",
        "lesson-proof",
        "open-graph"
      ]
    },
    {
      "id": "fx-diagnostic",
      "brandId": "frankx",
      "name": "Founder OS Diagnostic",
      "sourceKind": "diagnostic",
      "productForm": "diagnostic",
      "status": "queued",
      "commercialState": null,
      "releaseState": "validation",
      "coverPolicy": "Concept/validation cover allowed with exact status; no price, availability, customer, or launch claim.",
      "targetUrl": "https://frankx.ai/assess",
      "assetFamilies": [
        "instrument-cover",
        "process-strip",
        "output-preview",
        "open-graph"
      ]
    },
    {
      "id": "fx-primer",
      "brandId": "frankx",
      "name": "Six Primitives Primer",
      "sourceKind": "lead-magnet",
      "productForm": "guide",
      "status": "planned-in-repo",
      "commercialState": "free-public",
      "releaseState": "validation",
      "coverPolicy": "Concept/validation cover allowed with exact status; no price, availability, customer, or launch claim.",
      "targetUrl": "https://frankx.ai/products",
      "assetFamilies": [
        "document-cover",
        "interior-preview",
        "download-card",
        "open-graph"
      ]
    },
    {
      "id": "fx-pack",
      "brandId": "frankx",
      "name": "Six Primitives Pack",
      "sourceKind": "pack",
      "productForm": "pack",
      "status": "planned-in-repo",
      "commercialState": null,
      "releaseState": "validation",
      "coverPolicy": "Concept/validation cover allowed with exact status; no price, availability, customer, or launch claim.",
      "targetUrl": "https://frankx.ai/products",
      "assetFamilies": [
        "pack-cover",
        "contents-card",
        "owned-work-mechanism",
        "delivery-preview"
      ]
    },
    {
      "id": "fx-toolkit",
      "brandId": "frankx",
      "name": "Six Primitives Toolkit",
      "sourceKind": "toolkit",
      "productForm": "kit",
      "status": "planned-in-repo",
      "commercialState": "planned-in-repo",
      "releaseState": "validation",
      "coverPolicy": "Concept/validation cover allowed with exact status; no price, availability, customer, or launch claim.",
      "targetUrl": "https://frankx.ai/products",
      "assetFamilies": [
        "kit-cover",
        "contents-card",
        "mechanism-infographic",
        "delivery-preview"
      ]
    },
    {
      "id": "fx-founders",
      "brandId": "frankx",
      "name": "Founders Circle",
      "sourceKind": "retainer",
      "productForm": "retainer",
      "status": "planned-in-repo",
      "commercialState": "application-reviewed",
      "releaseState": "validation",
      "coverPolicy": "Concept/validation cover allowed with exact status; no price, availability, customer, or launch claim.",
      "targetUrl": "https://frankx.ai/products",
      "assetFamilies": [
        "program-card",
        "cadence-map",
        "deliverable-proof",
        "application-card"
      ]
    },
    {
      "id": "book-golden-age",
      "brandId": "frankx",
      "name": "Golden Age",
      "sourceKind": "book",
      "productForm": "book",
      "status": "live",